{
  "schemaVersion": "1.0.0",
  "note": "required validation 冻结约定，此前为交接书 §13.4。未冻结项必须显式登记，不得只存在于行内散文，否则会绕过收敛检查。一个切片可以有多条冻结验证。",
  "frozenQuadrupleFields": [
    "script",
    "fixture",
    "assertion",
    "exitSemantics"
  ],
  "unfrozen": [
    {
      "sliceId": "W-REL-D-GAMELOAD-01",
      "targetRelease": "V0.5",
      "reason": "真实 Sekiro 游戏内加载确认（SOULFORGE_SCRIPT_REAL_LOAD_CONFIRMED opt-in）"
    },
    {
      "sliceId": "W-REL-H-CROSSMACHINE-01",
      "targetRelease": "V0.5",
      "reason": "跨机/干净机 NSIS 安装/升级/卸载复现"
    },
    {
      "sliceId": "W-REL-V09-PUBLIC-PREVIEW-01",
      "targetRelease": "V0.9",
      "reason": "V0.9 发布线 V0.9.1 clean 源码 ZIP、启动 EXE/native 必需组件与 NSIS 安装包的归档/内容完整性、安装包哈希、安装/覆盖升级/卸载/已安装启动路径、内部文件排除、许可证 notices 及 GitHub 自动源码归档排除验证尚未冻结；旧跨机与真实游戏验收仍不声称完成"
    },
    {
      "sliceId": "W-FIRSTPARTY-SCHEMA-01",
      "targetRelease": "V0.5",
      "reason": "SoulForge first-party PARAM/EMEVD schema 的清洁环境、生产边界、Bridge synthetic 与真实 native corpus 验证尚未冻结；未覆盖或长度不匹配部分保持 partial/只读"
    }
  ],
  "frozen": [
    {
      "sliceId": "W-SCRIPT-READONLY-01",
      "targetRelease": "V0.5",
      "script": "npm run test:script-container-replace（本机环境注入时读取真实 luabnd）；npm run test:script-container-evidence（真实分支传入 luabnd 路径时）",
      "fixture": "仓库外 luabnd-primary（mods/script/aicommon.luabnd.dcx，DCX-DFLT->BND4，301 条目）；真实内层 .lua 条目",
      "assertion": "复制真实 luabnd 到临时 overlay；Bridge native write-bnd4 整内层替换（用户提供字节，等长 marker）→ PatchIR container_child_replace → WorkspaceTransaction 提交 → 重读条目数不变且内容更新 → operation 回滚与原文件字节一致；原 Mod 未被触碰；证据投影枚举 301 条目并分类 .lua 为 lua-bytecode",
      "exitSemantics": "命令须 exit 0 且真实容器实际执行；synthetic 分支 20 case 无条件运行；只支持容器级枚举/整内层替换闭环的 candidate，不证明脚本语义、反编译、重编译、typed mutation 或游戏加载"
    },
    {
      "sliceId": "W-EMEVD-FMG-PARAM-03",
      "targetRelease": "V0.5",
      "script": "npm run test:param-field-mutation；npm run test:paramdef-layout；npm run test:fmg-msb-ipc-contract；npm run test:param-msb-write-ipc-contract",
      "fixture": "ParamDefDocument 合成 definition（标量 + bitfield 共享字节）；runParamdefLayoutSmoke bitfield fixture；FMG add 四层接线静态断言源文件",
      "assertion": "applyParamFieldMutation 10 case：标量写入、bitfield 保留其他位、无效 base64/空行/行宽不匹配/字段不存在/越界结构化失败、源行不可变；EditorMutationKind 含 fmg_entry_add、contract fmg mutationKinds 含 fmg_entry_add、IPC/preload 类型含 add；param_field_set/applyParamFieldMutation IPC 通道接线 token",
      "exitSemantics": "四个命令均须 exit 0 且断言实际执行；只覆盖 TS 字段编码层与接线，不证明 Bridge 整行写入/真实 PARAM 文档/UI add 入口"
    },
    {
      "sliceId": "W-EMEVD-FULL-01",
      "targetRelease": "V0.5",
      "script": "npm run test:emevd-imported-production；npm run test:emevd-imported-coverage",
      "fixture": "syntheticEmevdBytes.createSyntheticDs3EmedfJson（自构 DarkScript3 格式 JSON，非真实 DarkScript3 数据）；真实 `emevd-primary`（mods/event/common.emevd.dcx，1,730 events / 33,266 instructions）；真实 EMEDF 文件经 SOULFORGE_EMEDF_PATH（用户本机，缺失 fail-closed）",
      "assertion": "imported-production：3 合成 leg（成功链/回滚链/失败链）+ 真实 corpus 事件级 id/rest + 2000:0 InitializeEvent eventId typed mutation；vararg 尾逐字节保留、未知指令 opaque、vararg 尾参数写编译期拒绝（EMEVD_DSL_VARARG_ARG_READONLY）、回滚恢复原字节 + 审计 failure_recovery、错误 hash → EMEVD_STAGING_WRITE_FAILED 目标未触碰；imported-coverage：analyzeEmedfCoverage 对真实分布分类 clean/长度不匹配/unknown，长度签名一致",
      "exitSemantics": "两命令须 exit 0；合成 leg 无条件运行；真实 corpus leg 依赖 SOULFORGE_NATIVE_FIXTURE_REGISTRY/SOULFORGE_NATIVE_FIXTURE_ROOT，缺失结构化跳过；真实 EMEDF 文件 leg 依赖 SOULFORGE_EMEDF_PATH，缺失结构化跳过（不冒充已交叉验证）"
    },
    {
      "sliceId": "W-EMEVD-FULL-01",
      "targetRelease": "V0.5",
      "script": "npm run test:emevd-corpus-matrix",
      "fixture": "合成 EMEVD（9 条指令：2× 0:0、5× 2000:0 覆盖 12/16/20/24/32、2 条 opaque 未知）；真实 `emevd-primary` common.emevd（33,266 指令 / 142 种）",
      "assertion": "合成 leg 5 个 typed arg/eventId mutation + 事件 id/rest 经 production 写链提交→Bridge 重读可观测、vararg 尾逐字节保留、opaque 指令字节保留；真实 leg：每个 schema 覆盖指令族 typed mutation 重读、全文档 33,266 条提交前后逐条字节比对（未覆盖 140 族 opaque 保持 30,081/30,081、covered-untouched 3,181/3,181）、未知指令双重 fail-closed（EMEDF_UNKNOWN_INSTRUCTION / EMEVD_DSL_UNKNOWN_INSTRUCTION_READONLY）、非法 vararg 长度结构化拒绝、事件级 id/rest mutation 重读可观测",
      "exitSemantics": "命令须 exit 0；合成 leg 无条件运行；真实 corpus leg 依赖本机 fixture env，缺失结构化跳过；typed mutation 只证明写链与等长替换，不证明参数语义或完整 EMEDF/layer/游戏加载"
    },
    {
      "sliceId": "W-EMEVD-FMG-PARAM-03",
      "targetRelease": "V0.5",
      "script": "npm run test:fmg-reference-integrity；npm run test:param-metadata-native",
      "fixture": "真实 `fmg-primary` item.msgbnd（18 FMG/3,480 entries）与 `bnd4-primary` menu.msgbnd（15 FMG/22,638 entries）；真实 `param-primary` gameparam.parambnd.dcx（138 容器条目）",
      "assertion": "synthetic 段 6 类诊断各 1 例 + clean 容器 + 位置确定性 + 输入不可变；真实段容器级引用扫描（重复 id→error/越界→error/悬空→warning/resolved→info）、`<?tag@id?>`/`<?tag?>` 语法提取、上限 512；param-metadata-native 135 matched/3 expected-unsupported（真实 Bridge 结构化诊断）/readFailed=0",
      "exitSemantics": "两命令须 exit 0；native 段依赖本机 fixture env，缺失结构化跳过；只读诊断不开放写路径；引用语义不声明容器外 tag；FMG 多语言仅 zhocn 如实"
    },
    {
      "sliceId": "W-REL-B-CORPUS-02",
      "targetRelease": "V0.5",
      "script": "npm run test:krak-combination-mutation；npm run bridge:verify:dcx-documents",
      "fixture": "3 个登记 KRAK-BND4 样本（m00/m11 talkesdbnd、m10 mapbnd，共 25 entries）；Oodle runtime（本机合法）",
      "assertion": "18 组合 case（3 样本 × 6：rename/replace/delete/move/add 组合含 add 后链式 rename/replace）：write-bnd4 mutations 数组单次 repack+单次 Kraken 重压+单次重读→独立重读→回滚 sha256 与真实游戏文件一致（零写入原版）；未知字段保持（no-op roundtrip + mutation 后未触条目 flags/unknown/stored bytes 逐字节一致，header 未知区 0x18/0x30-3F）；dcx-documents 214 DCX（144 DFLT/70 KRAK read/3 KRAK-BND4 CRUD+字段保持/75 DFLT-BND4）",
      "exitSemantics": "两命令须 exit 0 且真实样本实际执行；只覆盖实际执行的登记 corpus 操作，不外推完整 corpus；KRAK 外层 DCX 重压必然改变字节，整体字节级比对只适用 BND4 payload 层"
    },
    {
      "sliceId": "W-A-RECOVERY-INTEGRATION-04",
      "targetRelease": "V0.5",
      "script": "npm run test:power-loss-recovery；npm run test:large-transaction-recovery；npm run test:cross-session-journal；npm run test:upgrade-recovery",
      "fixture": "真实 WorkspaceTransaction + SQLite journal + 真实备份；合成 800-op 大容量事务；四会话跨会话场景；旧版 SQLite 迁移 1..3→6",
      "assertion": "power-loss：3 个 SIGKILL 注入点（hook-kill/mid-replace/committed-then-kill）子进程真实事务+SQLite journal+真实备份，journal 重放一致、未完成回滚、已提交重读一致、temp 清理、幂等；large-transaction：800 op 成功链（committed/800 files/800 backups/重读全匹配）+四阶段失败关闭+大容量恢复+损坏失败关闭（corruption_blocked 且 journal 非终态）；cross-session：4 会话无丢失/无重复+跨会话回滚+崩溃发现与修复；upgrade：旧 1..3→新 6 checksum 保留、已提交数据/journal/recovery point/audit 保留、旧中断事务用旧备份恢复",
      "exitSemantics": "四命令须 exit 0；只作用于 SoulForge 自身进程与临时 overlay，不触碰原版游戏目录；恢复策略为回滚到 before，不自动重放/不 roll-forward；真实 installer NSIS 升级生命周期仍环境门控"
    },
    {
      "sliceId": "W-BEHAVIOR-MAP-01",
      "targetRelease": "V0.5",
      "script": "npm run test:script-container-evidence（真实 leg 依赖本机 fixture env）；npm run probe:behavior-headers（依赖 SOULFORGE_SEKIRO_GAME_ROOT，缺失失败关闭）",
      "fixture": "仓库外 luabnd-primary = mods/script/aicommon.luabnd.dcx（DCX-DFLT->BND4，301 条目：299 .lua + 1 .luagnl + 1 .luainfo）",
      "assertion": "36 合成 case 无条件（分类/`\\x1bLuaP`/`\\x1bLuaQ` 家族 magic/文本 lua 诚实语义/`sanitizeEntryName` 确定性）；真实 301 条目枚举、扩展名分布、256 采样截断、magic 11/12 命中 `\\x1bLuaP`、文本 goal_list.lua magicVerified=false 如实、条目名脱敏无绝对路径/无 INTERROOT_win64",
      "exitSemantics": "命令须 exit 0 且断言实际执行；真实 leg 缺环境结构化 skipped；只支持容器级枚举与字节码格式识别（candidate），不证明脚本语义、反编译、重编译、typed mutation 或游戏加载；真实 magic 为 `\\x1bLuaP`（0x50）"
    },
    {
      "sliceId": "W-EMEVD-PATCHIR-02",
      "targetRelease": "V0.5",
      "script": "npm run test:emevd-plan-commit；npm run test:emevd-plan-production；npm run bridge:verify:emevd",
      "fixture": "syntheticEmevdBytes 微小合法合成 EMEVD（2 events / 3 instructions，含未知指令）+ EMEDF fixture；本机环境注入时注册 `emevd-primary`（mods/event/common.emevd.dcx，1,730 events / 33,266 instructions）",
      "assertion": "四视图 DSL submit 全链：compile → typed plan → Bridge batch staging → file_replace PatchIR → WorkspaceTransaction stage/validate/commit/backup/re-read，提交字节 hash 与 Bridge staged 输出及独立重读一致；after-commit validator 失败自动回滚且原字节恢复、暂存回收、failure 审计；错误 expectedDocumentHash 结构化失败关闭且目标文件不变；native 变体事件级 id/rest typed mutation 经 Bridge 重读可观测且事件/指令计数不变；计划应用于文档 revision+1",
      "exitSemantics": "三个命令均须 exit 0 且断言实际执行（native 变体缺环境时诚实 skip，不提升 authority）；只支持 production 接线切片 completed 与既有 partial 边界，不证明完整 EMEDF/layer/游戏加载"
    },
    {
      "sliceId": "W-A-RECOVERY-HARNESS-02",
      "targetRelease": "V0.5",
      "script": "npm run test:bridge-recovery-harness；npm run test:bridge-staging；npm run bridge:verify:client",
      "fixture": "系统临时目录中的 synthetic protocol-only fake daemon、含 4 MiB 字符串 payload 的背压 frame、四阶段 fault 与 11 个不安全 staging path segment case；不加载 native 资产",
      "assertion": "stage/validate/commit/re-read、超限 frame、注册期取消、timeout/cancel、同步/异步 progress、terminal race、背压 close/timeout/cancel、process exit 和显式 restart 全部结算；pending/timer 清理且无迟发 cancel；unhandledRejection=0；staging 不越界且终态无残留",
      "exitSemantics": "三个命令均须 exit 0 且断言实际执行才支持 fixture-confirmed；fake daemon、synthetic staging 和可复用 client 不提升任何 production native writer、A-RECOVERY 总体或 REL-A authority"
    },
    {
      "sliceId": "W-PARAM-META-01",
      "targetRelease": "V0.5",
      "script": "npm run test:param-metadata-mismatch；npm run test:paramdef-layout",
      "fixture": "synthetic metadata package/definition/trust policy/display-only overlay；严格五键 mismatch、SPDX、provenance、hostile primitive、Proxy/accessor/cycle/稀疏数组/undefined、容量与调用方/返回值 mutation 负向 case",
      "assertion": "package/source/license/definition digest 与 trust entry 闭合；匹配只读隔离 plain-data 快照；成功结果递归冻结且不冻结调用方输入；64 MiB canonical UTF-8 总预算与 256 条诊断上限失败关闭；snapshotFailureCases=9、aggregateSerializationBudgetCases=1、diagnosticLimitCases=1、immutableSnapshotCases=3",
      "exitSemantics": "两个命令均须 exit 0；只支持 fixture-confirmed metadata contract，不证明 Paramdex 数据已捆绑/获准再分发，也不提升 native PARAM parser/writer、真实 metadata source 或 REL-C"
    },
    {
      "sliceId": "W-PARAM-META-SOURCE-02",
      "targetRelease": "V0.5",